<?xml version="1.0" encoding="UTF-8"?>
<list xmlns:xsi="http://www.w3.org/2001/XMLSchema-instance" xsi:noNamespaceSchemaLocation="../../../xsd/worldEvent.xsd">
	<event id="14" nameRu="Кролики" nameEn="Rabbits" activate="false">
		<time startPattern="0 20 * * 7" stopPattern="2 20 * * 7" isNonStop="false" />
		<spawnlist>
			<!-- Event Manager -->
			<location name="Fantasy Isle" x="-59227" y="-56939" z="-2032" h="64106" />
			<!-- Mobs Territory -->
			<territory name="Fantasy Isle">
				<add x="-58712" y="-55880" zmin="-2040" zmax="-2000" />
				<add x="-60744" y="-55896" zmin="-2040" zmax="-2000" />
				<add x="-60744" y="-57912" zmin="-2040" zmax="-2000" />
				<add x="-58712" y="-57912" zmin="-2040" zmax="-2000" />
			</territory>
		</spawnlist>
		<droplist>
			<item id="1540" min="10" max="15" chance="80" /> <!-- Quick Healing Potion -->
			<item id="1538" min="5" max="10" chance="60" /> <!-- Blessed Scroll of Escape -->
			<item id="3936" min="5" max="10" chance="40" /> <!-- Blessed Scroll of Resurrection -->
			<item id="6387" min="5" max="10" chance="25" /> <!-- Blessed Scroll of Resurrection for Pets -->
			<item id="22025" min="5" max="10" chance="10" /> <!-- Greater Healing Potion -->
			<item id="6622" min="1" max="1" chance="5" /> <!-- Giant's Codex -->
			<item id="20034" min="1" max="1" chance="5" /> <!-- Revita-Pop -->
			<item id="20004" min="1" max="1" chance="5" /> <!-- Vitality Ginseng -->
		</droplist>
		<add_parameters>
			<set name="canUseMagic" value="false" />
			<set name="totalAmount" value="100" />
		</add_parameters>
	</event>
</list>