<?xml version="1.0" encoding="UTF-8"?>
<list xmlns:xsi="http://www.w3.org/2001/XMLSchema-instance" xsi:noNamespaceSchemaLocation="../../../xsd/worldEvent.xsd">
	<event id="8" nameRu="Свадьба" nameEn="Grand Wedding" activate="false">
		<time startPattern="30 9 1 * *" stopPattern="30 9 30 * *" isNonStop="false" />
		<spawnlist>
			<!-- Event Manager -->
			<npc id="102510" x="146364" y="27322" z="-2205" heading="62980" />
			<npc id="102510" x="147982" y="-56568" z="-2781" heading="20998" />
			<npc id="102510" x="83486" y="149328" z="-3405" heading="47599" />
		</spawnlist>
		<rewardlist>
			<variant id="1">
				<!-- Reward Items -->
				<reward id="4037" min="10" />
			</variant>
		</rewardlist>
	</event>
</list>